"No.","Time","Source","Destination","Protocol","Length","Info"
"1","0.000000","2620:1ec:bdf::58","2401:4900:633f:c147:1c1d:acc7:1e68:b337","TLSv1.2","113","Application Data"
"2","0.000000","2620:1ec:bdf::58","2401:4900:633f:c147:1c1d:acc7:1e68:b337","TLSv1.2","98","Application Data"
"3","0.000000","2620:1ec:bdf::58","2401:4900:633f:c147:1c1d:acc7:1e68:b337","TCP","74","443  >  56215 [FIN, ACK] Seq=64 Ack=1 Win=105 Len=0"
"4","0.000064","2401:4900:633f:c147:1c1d:acc7:1e68:b337","2620:1ec:bdf::58","TCP","74","56215  >  443 [ACK] Seq=1 Ack=65 Win=255 Len=0"
"5","0.000207","2401:4900:633f:c147:1c1d:acc7:1e68:b337","2620:1ec:bdf::58","TCP","74","56215  >  443 [FIN, ACK] Seq=1 Ack=65 Win=255 Len=0"
"6","0.016241","2620:1ec:bdf::58","2401:4900:633f:c147:1c1d:acc7:1e68:b337","TCP","74","443  >  56215 [ACK] Seq=65 Ack=2 Win=105 Len=0"
"7","2.220922","10.200.251.252","10.200.251.29","DNS","70","Standard query 0xd27b A c.pki.goog"
"8","2.221157","10.200.251.252","10.200.251.29","DNS","70","Standard query 0x2070 AAAA c.pki.goog"
"9","2.266627","10.200.251.29","10.200.251.252","DNS","133","Standard query response 0x2070 AAAA c.pki.goog CNAME pki-goog.l.google.com AAAA 2404:6800:4007:80f::2003"
"10","2.266871","10.200.251.29","10.200.251.252","DNS","121","Standard query response 0xd27b A c.pki.goog CNAME pki-goog.l.google.com A 142.250.77.131"
"11","2.270426","2401:4900:633f:c147:1c1d:acc7:1e68:b337","2404:6800:4007:80f::2003","TCP","86","55618  >  80 [SYN] Seq=0 Win=65535 Len=0 MSS=1440 WS=256 SACK_PERM"
"12","2.289035","2404:6800:4007:80f::2003","2401:4900:633f:c147:1c1d:acc7:1e68:b337","TCP","86","80  >  55618 [SYN, ACK] Seq=0 Ack=1 Win=65535 Len=0 MSS=1255 SACK_PERM WS=256"
"13","2.289129","2401:4900:633f:c147:1c1d:acc7:1e68:b337","2404:6800:4007:80f::2003","TCP","74","55618  >  80 [ACK] Seq=1 Ack=1 Win=65280 Len=0"
"14","2.289282","2401:4900:633f:c147:1c1d:acc7:1e68:b337","2404:6800:4007:80f::2003","HTTP","274","GET /r/r4.crl HTTP/1.1 "
"15","2.306804","2404:6800:4007:80f::2003","2401:4900:633f:c147:1c1d:acc7:1e68:b337","TCP","74","80  >  55618 [ACK] Seq=1 Ack=201 Win=269312 Len=0"
"16","2.319775","2404:6800:4007:80f::2003","2401:4900:633f:c147:1c1d:acc7:1e68:b337","TCP","1294","80  >  55618 [ACK] Seq=1 Ack=201 Win=269312 Len=1220 [TCP PDU reassembled in 17]"
"17","2.319775","2404:6800:4007:80f::2003","2401:4900:633f:c147:1c1d:acc7:1e68:b337","PKIX-CRL","95","Certificate Revocation List"
"18","2.319813","2401:4900:633f:c147:1c1d:acc7:1e68:b337","2404:6800:4007:80f::2003","TCP","74","55618  >  80 [ACK] Seq=201 Ack=1242 Win=64256 Len=0"
"19","3.186360","10.200.251.252","10.200.251.29","DNS","96","Standard query 0x539e AAAA script-version.ipn.monetizemyapp.net"
"20","3.481125","10.200.251.29","10.200.251.252","DNS","96","Standard query response 0x539e AAAA script-version.ipn.monetizemyapp.net"
"21","3.481864","10.200.251.252","23.227.142.154","TCP","66","55619  >  80 [SYN] Seq=0 Win=65535 Len=0 MSS=1460 WS=256 SACK_PERM"
"22","3.933890","23.227.142.154","10.200.251.252","TCP","66","80  >  55619 [SYN, ACK] Seq=0 Ack=1 Win=65535 Len=0 MSS=1275 SACK_PERM WS=1024"
"23","3.934001","10.200.251.252","23.227.142.154","TCP","54","55619  >  80 [ACK] Seq=1 Ack=1 Win=65280 Len=0"
"24","3.934221","10.200.251.252","23.227.142.154","HTTP","177","GET /easyasvpn/script/version.txt?version=1.1.6 HTTP/1.1 "
"25","4.266770","2401:4900:633f:c147:1c1d:acc7:1e68:b337","2603:1063:37::26","TCP","75","52074  >  443 [ACK] Seq=1 Ack=1 Win=254 Len=1"
"26","4.288593","23.227.142.154","10.200.251.252","TCP","54","80  >  55619 [ACK] Seq=1 Ack=124 Win=65536 Len=0"
"27","4.288729","23.227.142.154","10.200.251.252","HTTP","296","HTTP/1.1 200 OK  (text/plain)"
"28","4.288785","10.200.251.252","23.227.142.154","TCP","54","55619  >  80 [ACK] Seq=124 Ack=244 Win=65280 Len=0"
"29","4.289789","10.200.251.252","23.227.142.154","TCP","54","55619  >  80 [FIN, ACK] Seq=124 Ack=244 Win=65280 Len=0"
"30","4.318672","10.200.251.252","10.200.251.29","DNS","88","Standard query 0xced9 AAAA script.ipn.monetizemyapp.net"
"31","4.340740","2603:1063:37::26","2401:4900:633f:c147:1c1d:acc7:1e68:b337","TCP","74","443  >  52074 [ACK] Seq=1 Ack=2 Win=535 Len=0"
"32","4.542643","10.200.251.29","10.200.251.252","DNS","88","Standard query response 0xced9 AAAA script.ipn.monetizemyapp.net"
"33","4.544057","10.200.251.252","23.227.142.154","TCP","66","55620  >  80 [SYN] Seq=0 Win=65535 Len=0 MSS=1460 WS=256 SACK_PERM"
"34","5.040142","23.227.142.154","10.200.251.252","TCP","54","80  >  55619 [ACK] Seq=244 Ack=125 Win=65536 Len=0"
"35","5.040314","23.227.142.154","10.200.251.252","TCP","58","80  >  55620 [SYN, ACK] Seq=0 Ack=1 Win=65535 Len=0 MSS=1275"
"36","5.040314","23.227.142.154","10.200.251.252","TCP","58","[TCP Retransmission] 80  >  55620 [SYN, ACK] Seq=0 Ack=1 Win=65535 Len=0 MSS=1275"
"37","5.040412","10.200.251.252","23.227.142.154","TCP","54","55620  >  80 [ACK] Seq=1 Ack=1 Win=65535 Len=0"
"38","5.040688","10.200.251.252","23.227.142.154","HTTP","282","GET /easyasvpn/script/script.js?version=1.1.6 HTTP/1.1 "
"39","5.427329","23.227.142.154","10.200.251.252","TCP","54","80  >  55620 [ACK] Seq=1 Ack=229 Win=65535 Len=0"
"40","5.427329","23.227.142.154","10.200.251.252","TCP","590","80  >  55620 [ACK] Seq=1 Ack=229 Win=65535 Len=536 [TCP PDU reassembled in 1843]"
"41","5.427329","23.227.142.154","10.200.251.252","TCP","590","80  >  55620 [ACK] Seq=537 Ack=229 Win=65535 Len=536 [TCP PDU reassembled in 1843]"
"42","5.427329","23.227.142.154","10.200.251.252","TCP","590","80  >  55620 [ACK] Seq=1073 Ack=229 Win=65535 Len=536 [TCP PDU reassembled in 1843]"
"43","5.427329","23.227.142.154","10.200.251.252","TCP","590","80  >  55620 [ACK] Seq=1609 Ack=229 Win=65535 Len=536 [TCP PDU reassembled in 1843]"
"44","5.427329","23.227.142.154","10.200.251.252","TCP","590","80  >  55620 [PSH, ACK] Seq=2145 Ack=229 Win=65535 Len=536 [TCP PDU reassembled in 1843]"
"45","5.427329","23.227.142.154","10.200.251.252","TCP","590","80  >  55620 [ACK] Seq=2681 Ack=229 Win=65535 Len=536 [TCP PDU reassembled in 1843]"
"46","5.427329","23.227.142.154","10.200.251.252","TCP","590","80  >  55620 [ACK] Seq=3217 Ack=229 Win=65535 Len=536 [TCP PDU reassembled in 1843]"
"47","5.427329","23.227.142.154","10.200.251.252","TCP","590","80  >  55620 [ACK] Seq=3753 Ack=229 Win=65535 Len=536 [TCP PDU reassembled in 1843]"
"48","5.427329","23.227.142.154","10.200.251.252","TCP","590","80  >  55620 [ACK] Seq=4289 Ack=229 Win=65535 Len=536 [TCP PDU reassembled in 1843]"
"49","5.427410","10.200.251.252","23.227.142.154","TCP","54","55620  >  80 [ACK] Seq=229 Ack=4825 Win=65535 Len=0"
"50","5.427518","23.227.142.154","10.200.251.252","TCP","590","80  >  55620 [PSH, ACK] Seq=4825 Ack=229 Win=65535 Len=536 [TCP PDU reassembled in 1843]"
"51","5.427538","10.200.251.252","23.227.142.154","TCP","54","55620  >  80 [ACK] Seq=229 Ack=5361 Win=64999 Len=0"
"52","5.646250","fe80::c894:e3ff:fe51:487","2401:4900:633f:c147:1c1d:acc7:1e68:b337","ICMPv6","86","Neighbor Solicitation for 2401:4900:633f:c147:1c1d:acc7:1e68:b337 from ca:94:e3:51:04:87"
"53","5.646304","2401:4900:633f:c147:1c1d:acc7:1e68:b337","fe80::c894:e3ff:fe51:487","ICMPv6","86","Neighbor Advertisement 2401:4900:633f:c147:1c1d:acc7:1e68:b337 (sol, ovr) is at dc:45:46:5f:85:b1"
"54","5.738588","23.227.142.154","10.200.251.252","TCP","590","80  >  55620 [ACK] Seq=5361 Ack=229 Win=65535 Len=536 [TCP PDU reassembled in 1843]"
"55","5.738588","23.227.142.154","10.200.251.252","TCP","590","80  >  55620 [PSH, ACK] Seq=5897 Ack=229 Win=65535 Len=536 [TCP PDU reassembled in 1843]"
"56","5.738588","23.227.142.154","10.200.251.252","TCP","590","80  >  55620 [ACK] Seq=6433 Ack=229 Win=65535 Len=536 [TCP PDU reassembled in 1843]"
"57","5.738588","23.227.142.154","10.200.251.252","TCP","590","80  >  55620 [PSH, ACK] Seq=6969 Ack=229 Win=65535 Len=536 [TCP PDU reassembled in 1843]"
"58","5.738588","23.227.142.154","10.200.251.252","TCP","590","80  >  55620 [ACK] Seq=7505 Ack=229 Win=65535 Len=536 [TCP PDU reassembled in 1843]"
"59","5.738588","23.227.142.154","10.200.251.252","TCP","590","80  >  55620 [PSH, ACK] Seq=8041 Ack=229 Win=65535 Len=536 [TCP PDU reassembled in 1843]"
"60","5.738588","23.227.142.154","10.200.251.252","TCP","590","80  >  55620 [ACK] Seq=8577 Ack=229 Win=65535 Len=536 [TCP PDU reassembled in 1843]"
"61","5.738588","23.227.142.154","10.200.251.252","TCP","590","80  >  55620 [PSH, ACK] Seq=9113 Ack=229 Win=65535 Len=536 [TCP PDU reassembled in 1843]"
"62","5.738588","23.227.142.154","10.200.251.252","TCP","590","80  >  55620 [ACK] Seq=9649 Ack=229 Win=65535 Len=536 [TCP PDU reassembled in 1843]"
"63","5.738588","23.227.142.154","10.200.251.252","TCP","590","80  >  55620 [PSH, ACK] Seq=10185 Ack=229 Win=65535 Len=536 [TCP PDU reassembled in 1843]"
"64","5.738588","23.227.142.154","10.200.251.252","TCP","590","80  >  55620 [ACK] Seq=10721 Ack=229 Win=65535 Len=536 [TCP PDU reassembled in 1843]"
"65","5.738588","23.227.142.154","10.200.251.252","TCP","590","80  >  55620 [PSH, ACK] Seq=11257 Ack=229 Win=65535 Len=536 [TCP PDU reassembled in 1843]"
"66","5.738588","23.227.142.154","10.200.251.252","TCP","590","80  >  55620 [ACK] Seq=11793 Ack=229 Win=65535 Len=536 [TCP PDU reassembled in 1843]"
"67","5.738588","23.227.142.154","10.200.251.252","TCP","590","80  >  55620 [PSH, ACK] Seq=12329 Ack=229 Win=65535 Len=536 [TCP PDU reassembled in 1843]"
"68","5.738588","23.227.142.154","10.200.251.252","TCP","590","80  >  55620 [ACK] Seq=12865 Ack=229 Win=65535 Len=536 [TCP PDU reassembled in 1843]"
"69","5.738588","23.227.142.154","10.200.251.252","TCP","590","80  >  55620 [PSH, ACK] Seq=13401 Ack=229 Win=65535 Len=536 [TCP PDU reassembled in 1843]"
"70","5.738588","23.227.142.154","10.200.251.252","TCP","590","80  >  55620 [ACK] Seq=13937 Ack=229 Win=65535 Len=536 [TCP PDU reassembled in 1843]"
"71","5.738588","23.227.142.154","10.200.251.252","TCP","590","80  >  55620 [PSH, ACK] Seq=14473 Ack=229 Win=65535 Len=536 [TCP PDU reassembled in 1843]"
"72","5.738588","23.227.142.154","10.200.251.252","TCP","590","80  >  55620 [ACK] Seq=15009 Ack=229 Win=65535 Len=536 [TCP PDU reassembled in 1843]"
"73","5.738588","23.227.142.154","10.200.251.252","TCP","590","80  >  55620 [PSH, ACK] Seq=15545 Ack=229 Win=65535 Len=536 [TCP PDU reassembled in 1843]"
"74","5.738692","10.200.251.252","23.227.142.154","TCP","54","55620  >  80 [ACK] Seq=229 Ack=16081 Win=65535 Len=0"
"75","6.145981","23.227.142.154","10.200.251.252","TCP","590","80  >  55620 [ACK] Seq=16081 Ack=229 Win=65535 Len=536 [TCP PDU reassembled in 1843]"
"76","6.145981","23.227.142.154","10.200.251.252","TCP","590","80  >  55620 [PSH, ACK] Seq=16617 Ack=229 Win=65535 Len=536 [TCP PDU reassembled in 1843]"
"77","6.145981","23.227.142.154","10.200.251.252","TCP","590","80  >  55620 [ACK] Seq=17153 Ack=229 Win=65535 Len=536 [TCP PDU reassembled in 1843]"
"78","6.145981","23.227.142.154","10.200.251.252","TCP","590","80  >  55620 [PSH, ACK] Seq=17689 Ack=229 Win=65535 Len=536 [TCP PDU reassembled in 1843]"
"79","6.145981","23.227.142.154","10.200.251.252","TCP","590","80  >  55620 [ACK] Seq=18225 Ack=229 Win=65535 Len=536 [TCP PDU reassembled in 1843]"
"80","6.145981","23.227.142.154","10.200.251.252","TCP","590","80  >  55620 [PSH, ACK] Seq=18761 Ack=229 Win=65535 Len=536 [TCP PDU reassembled in 1843]"
"81","6.145981","23.227.142.154","10.200.251.252","TCP","590","80  >  55620 [ACK] Seq=19297 Ack=229 Win=65535 Len=536 [TCP PDU reassembled in 1843]"
"82","6.145981","23.227.142.154","10.200.251.252","TCP","590","80  >  55620 [PSH, ACK] Seq=19833 Ack=229 Win=65535 Len=536 [TCP PDU reassembled in 1843]"
"83","6.145981","23.227.142.154","10.200.251.252","TCP","590","80  >  55620 [ACK] Seq=20369 Ack=229 Win=65535 Len=536 [TCP PDU reassembled in 1843]"
"84","6.145981","23.227.142.154","10.200.251.252","TCP","590","80  >  55620 [PSH, ACK] Seq=20905 Ack=229 Win=65535 Len=536 [TCP PDU reassembled in 1843]"
"85","6.145981","23.227.142.154","10.200.251.252","TCP","590","80  >  55620 [ACK] Seq=21441 Ack=229 Win=65535 Len=536 [TCP PDU reassembled in 1843]"
"86","6.145981","23.227.142.154","10.200.251.252","TCP","590","80  >  55620 [PSH, ACK] Seq=21977 Ack=229 Win=65535 Len=536 [TCP PDU reassembled in 1843]"
"87","6.145981","23.227.142.154","10.200.251.252","TCP","590","80  >  55620 [ACK] Seq=22513 Ack=229 Win=65535 Len=536 [TCP PDU reassembled in 1843]"
"88","6.145981","23.227.142.154","10.200.251.252","TCP","590","80  >  55620 [PSH, ACK] Seq=23049 Ack=229 Win=65535 Len=536 [TCP PDU reassembled in 1843]"
"89","6.145981","23.227.142.154","10.200.251.252","TCP","590","80  >  55620 [ACK] Seq=23585 Ack=229 Win=65535 Len=536 [TCP PDU reassembled in 1843]"
"90","6.145981","23.227.142.154","10.200.251.252","TCP","590","80  >  55620 [PSH, ACK] Seq=24121 Ack=229 Win=65535 Len=536 [TCP PDU reassembled in 1843]"
"91","6.145981","23.227.142.154","10.200.251.252","TCP","590","80  >  55620 [ACK] Seq=24657 Ack=229 Win=65535 Len=536 [TCP PDU reassembled in 1843]"
"92","6.145981","23.227.142.154","10.200.251.252","TCP","590","80  >  55620 [PSH, ACK] Seq=25193 Ack=229 Win=65535 Len=536 [TCP PDU reassembled in 1843]"
"93","6.145981","23.227.142.154","10.200.251.252","TCP","590","80  >  55620 [ACK] Seq=25729 Ack=229 Win=65535 Len=536 [TCP PDU reassembled in 1843]"
"94","6.145981","23.227.142.154","10.200.251.252","TCP","590","80  >  55620 [PSH, ACK] Seq=26265 Ack=229 Win=65535 Len=536 [TCP PDU reassembled in 1843]"
"95","6.145981","23.227.142.154","10.200.251.252","TCP","590","80  >  55620 [ACK] Seq=26801 Ack=229 Win=65535 Len=536 [TCP PDU reassembled in 1843]"
"96","6.145981","23.227.142.154","10.200.251.252","TCP","590","80  >  55620 [PSH, ACK] Seq=27337 Ack=229 Win=65535 Len=536 [TCP PDU reassembled in 1843]"
"97","6.145981","23.227.142.154","10.200.251.252","TCP","590","80  >  55620 [ACK] Seq=27873 Ack=229 Win=65535 Len=536 [TCP PDU reassembled in 1843]"
"98","6.145981","23.227.142.154","10.200.251.252","TCP","590","80  >  55620 [PSH, ACK] Seq=28409 Ack=229 Win=65535 Len=536 [TCP PDU reassembled in 1843]"
"99","6.145981","23.227.142.154","10.200.251.252","TCP","590","80  >  55620 [ACK] Seq=28945 Ack=229 Win=65535 Len=536 [TCP PDU reassembled in 1843]"
"100","6.145981","23.227.142.154","10.200.251.252","TCP","590","80  >  55620 [PSH, ACK] Seq=29481 Ack=229 Win=65535 Len=536 [TCP PDU reassembled in 1843]"
"101","6.145981","23.227.142.154","10.200.251.252","TCP","590","80  >  55620 [ACK] Seq=30017 Ack=229 Win=65535 Len=536 [TCP PDU reassembled in 1843]"
"102","6.145981","23.227.142.154","10.200.251.252","TCP","590","80  >  55620 [PSH, ACK] Seq=30553 Ack=229 Win=65535 Len=536 [TCP PDU reassembled in 1843]"
"103","6.145981","23.227.142.154","10.200.251.252","TCP","590","80  >  55620 [ACK] Seq=31089 Ack=229 Win=65535 Len=536 [TCP PDU reassembled in 1843]"
"104","6.145981","23.227.142.154","10.200.251.252","TCP","590","80  >  55620 [PSH, ACK] Seq=31625 Ack=229 Win=65535 Len=536 [TCP PDU reassembled in 1843]"
"105","6.145981","23.227.142.154","10.200.251.252","TCP","590","80  >  55620 [ACK] Seq=32161 Ack=229 Win=65535 Len=536 [TCP PDU reassembled in 1843]"
"106","6.145981","23.227.142.154","10.200.251.252","TCP","590","80  >  55620 [PSH, ACK] Seq=32697 Ack=229 Win=65535 Len=536 [TCP PDU reassembled in 1843]"
"107","6.147057","10.200.251.252","23.227.142.154","TCP","54","55620  >  80 [ACK] Seq=229 Ack=33233 Win=65535 Len=0"
"108","6.147375","23.227.142.154","10.200.251.252","TCP","590","80  >  55620 [ACK] Seq=33233 Ack=229 Win=65535 Len=536 [TCP PDU reassembled in 1843]"
"109","6.147375","23.227.142.154","10.200.251.252","TCP","590","80  >  55620 [PSH, ACK] Seq=33769 Ack=229 Win=65535 Len=536 [TCP PDU reassembled in 1843]"
"110","6.147375","23.227.142.154","10.200.251.252","TCP","590","80  >  55620 [ACK] Seq=34305 Ack=229 Win=65535 Len=536 [TCP PDU reassembled in 1843]"
"111","6.147375","23.227.142.154","10.200.251.252","TCP","590","80  >  55620 [PSH, ACK] Seq=34841 Ack=229 Win=65535 Len=536 [TCP PDU reassembled in 1843]"
"112","6.147375","23.227.142.154","10.200.251.252","TCP","590","80  >  55620 [ACK] Seq=35377 Ack=229 Win=65535 Len=536 [TCP PDU reassembled in 1843]"
"113","6.147375","23.227.142.154","10.200.251.252","TCP","590","80  >  55620 [PSH, ACK] Seq=35913 Ack=229 Win=65535 Len=536 [TCP PDU reassembled in 1843]"
"114","6.147375","23.227.142.154","10.200.251.252","TCP","590","80  >  55620 [ACK] Seq=36449 Ack=229 Win=65535 Len=536 [TCP PDU reassembled in 1843]"
"115","6.147375","23.227.142.154","10.200.251.252","TCP","590","80  >  55620 [PSH, ACK] Seq=36985 Ack=229 Win=65535 Len=536 [TCP PDU reassembled in 1843]"
"116","6.147420","10.200.251.252","23.227.142.154","TCP","54","55620  >  80 [ACK] Seq=229 Ack=37521 Win=65535 Len=0"
"117","6.558202","23.227.142.154","10.200.251.252","TCP","590","80  >  55620 [ACK] Seq=37521 Ack=229 Win=65535 Len=536 [TCP PDU reassembled in 1843]"
"118","6.558202","23.227.142.154","10.200.251.252","TCP","590","80  >  55620 [ACK] Seq=38057 Ack=229 Win=65535 Len=536 [TCP PDU reassembled in 1843]"
"119","6.558202","23.227.142.154","10.200.251.252","TCP","590","80  >  55620 [PSH, ACK] Seq=38593 Ack=229 Win=65535 Len=536 [TCP PDU reassembled in 1843]"
"120","6.558202","23.227.142.154","10.200.251.252","TCP","590","80  >  55620 [ACK] Seq=39129 Ack=229 Win=65535 Len=536 [TCP PDU reassembled in 1843]"
"121","6.558359","10.200.251.252","23.227.142.154","TCP","54","55620  >  80 [ACK] Seq=229 Ack=39665 Win=65535 Len=0"
"122","6.558528","2600:140f:5e00:5::17d3:3c71","2401:4900:633f:c147:1c1d:acc7:1e68:b337","TLSv1.2","98","Application Data"
"123","6.558528","2600:140f:5e00:5::17d3:3c71","2401:4900:633f:c147:1c1d:acc7:1e68:b337","TCP","74","443  >  53172 [FIN, ACK] Seq=25 Ack=1 Win=566 Len=0"
"124","6.558528","2600:140f:5e00:5::17d3:3c71","2401:4900:633f:c147:1c1d:acc7:1e68:b337","TCP","74","[TCP Retransmission] 443  >  53172 [FIN, ACK] Seq=25 Ack=1 Win=566 Len=0"
"125","6.558611","2401:4900:633f:c147:1c1d:acc7:1e68:b337","2600:140f:5e00:5::17d3:3c71","TCP","74","53172  >  443 [ACK] Seq=1 Ack=26 Win=1023 Len=0"
"126","6.559045","23.227.142.154","10.200.251.252","TCP","590","80  >  55620 [PSH, ACK] Seq=39665 Ack=229 Win=65535 Len=536 [TCP PDU reassembled in 1843]"
"127","6.559045","23.227.142.154","10.200.251.252","TCP","590","80  >  55620 [ACK] Seq=40201 Ack=229 Win=65535 Len=536 [TCP PDU reassembled in 1843]"
"128","6.559045","23.227.142.154","10.200.251.252","TCP","590","80  >  55620 [PSH, ACK] Seq=40737 Ack=229 Win=65535 Len=536 [TCP PDU reassembled in 1843]"
"129","6.559045","23.227.142.154","10.200.251.252","TCP","590","80  >  55620 [ACK] Seq=41273 Ack=229 Win=65535 Len=536 [TCP PDU reassembled in 1843]"
"130","6.559045","23.227.142.154","10.200.251.252","TCP","590","80  >  55620 [PSH, ACK] Seq=41809 Ack=229 Win=65535 Len=536 [TCP PDU reassembled in 1843]"
"131","6.559045","23.227.142.154","10.200.251.252","TCP","590","80  >  55620 [ACK] Seq=42345 Ack=229 Win=65535 Len=536 [TCP PDU reassembled in 1843]"
"132","6.559045","23.227.142.154","10.200.251.252","TCP","590","80  >  55620 [PSH, ACK] Seq=42881 Ack=229 Win=65535 Len=536 [TCP PDU reassembled in 1843]"
"133","6.559045","23.227.142.154","10.200.251.252","TCP","590","80  >  55620 [ACK] Seq=43417 Ack=229 Win=65535 Len=536 [TCP PDU reassembled in 1843]"
"134","6.559045","23.227.142.154","10.200.251.252","TCP","590","80  >  55620 [PSH, ACK] Seq=43953 Ack=229 Win=65535 Len=536 [TCP PDU reassembled in 1843]"
"135","6.559045","23.227.142.154","10.200.251.252","TCP","590","80  >  55620 [ACK] Seq=44489 Ack=229 Win=65535 Len=536 [TCP PDU reassembled in 1843]"
"136","6.559045","23.227.142.154","10.200.251.252","TCP","590","80  >  55620 [PSH, ACK] Seq=45025 Ack=229 Win=65535 Len=536 [TCP PDU reassembled in 1843]"
"137","6.559045","23.227.142.154","10.200.251.252","TCP","590","80  >  55620 [ACK] Seq=45561 Ack=229 Win=65535 Len=536 [TCP PDU reassembled in 1843]"
"138","6.559045","23.227.142.154","10.200.251.252","TCP","590","80  >  55620 [PSH, ACK] Seq=46097 Ack=229 Win=65535 Len=536 [TCP PDU reassembled in 1843]"
"139","6.559045","23.227.142.154","10.200.251.252","TCP","590","80  >  55620 [ACK] Seq=46633 Ack=229 Win=65535 Len=536 [TCP PDU reassembled in 1843]"
"140","6.559045","23.227.142.154","10.200.251.252","TCP","590","80  >  55620 [PSH, ACK] Seq=47169 Ack=229 Win=65535 Len=536 [TCP PDU reassembled in 1843]"
"141","6.559045","23.227.142.154","10.200.251.252","TCP","590","80  >  55620 [ACK] Seq=47705 Ack=229 Win=65535 Len=536 [TCP PDU reassembled in 1843]"
"142","6.559045","23.227.142.154","10.200.251.252","TCP","590","80  >  55620 [PSH, ACK] Seq=48241 Ack=229 Win=65535 Len=536 [TCP PDU reassembled in 1843]"
"143","6.559045","23.227.142.154","10.200.251.252","TCP","590","80  >  55620 [ACK] Seq=48777 Ack=229 Win=65535 Len=536 [TCP PDU reassembled in 1843]"
"144","6.559045","23.227.142.154","10.200.251.252","TCP","590","80  >  55620 [PSH, ACK] Seq=49313 Ack=229 Win=65535 Len=536 [TCP PDU reassembled in 1843]"
"145","6.559045","23.227.142.154","10.200.251.252","TCP","590","80  >  55620 [ACK] Seq=49849 Ack=229 Win=65535 Len=536 [TCP PDU reassembled in 1843]"
"146","6.559045","23.227.142.154","10.200.251.252","TCP","590","80  >  55620 [PSH, ACK] Seq=50385 Ack=229 Win=65535 Len=536 [TCP PDU reassembled in 1843]"
"147","6.559045","23.227.142.154","10.200.251.252","TCP","590","80  >  55620 [ACK] Seq=50921 Ack=229 Win=65535 Len=536 [TCP PDU reassembled in 1843]"
"148","6.559045","23.227.142.154","10.200.251.252","TCP","590","80  >  55620 [PSH, ACK] Seq=51457 Ack=229 Win=65535 Len=536 [TCP PDU reassembled in 1843]"
"149","6.559045","23.227.142.154","10.200.251.252","TCP","590","80  >  55620 [ACK] Seq=51993 Ack=229 Win=65535 Len=536 [TCP PDU reassembled in 1843]"
"150","6.559045","23.227.142.154","10.200.251.252","TCP","590","80  >  55620 [PSH, ACK] Seq=52529 Ack=229 Win=65535 Len=536 [TCP PDU reassembled in 1843]"
"151","6.559045","23.227.142.154","10.200.251.252","TCP","590","80  >  55620 [ACK] Seq=53065 Ack=229 Win=65535 Len=536 [TCP PDU reassembled in 1843]"
"152","6.559045","23.227.142.154","10.200.251.252","TCP","590","80  >  55620 [PSH, ACK] Seq=53601 Ack=229 Win=65535 Len=536 [TCP PDU reassembled in 1843]"
"153","6.559045","23.227.142.154","10.200.251.252","TCP","590","80  >  55620 [ACK] Seq=54137 Ack=229 Win=65535 Len=536 [TCP PDU reassembled in 1843]"
"154","6.559045","23.227.142.154","10.200.251.252","TCP","590","80  >  55620 [PSH, ACK] Seq=54673 Ack=229 Win=65535 Len=536 [TCP PDU reassembled in 1843]"
"155","6.559045","23.227.142.154","10.200.251.252","TCP","590","80  >  55620 [ACK] Seq=55209 Ack=229 Win=65535 Len=536 [TCP PDU reassembled in 1843]"
"156","6.559045","23.227.142.154","10.200.251.252","TCP","590","80  >  55620 [PSH, ACK] Seq=55745 Ack=229 Win=65535 Len=536 [TCP PDU reassembled in 1843]"
"157","6.559045","23.227.142.154","10.200.251.252","TCP","590","80  >  55620 [ACK] Seq=56281 Ack=229 Win=65535 Len=536 [TCP PDU reassembled in 1843]"
"158","6.559279","10.200.251.252","23.227.142.154","TCP","54","55620  >  80 [ACK] Seq=229 Ack=56817 Win=65535 Len=0"
"159","6.559405","23.227.142.154","10.200.251.252","TCP","590","80  >  55620 [PSH, ACK] Seq=56817 Ack=229 Win=65535 Len=536 [TCP PDU reassembled in 1843]"
"160","6.559405","23.227.142.154","10.200.251.252","TCP","590","80  >  55620 [ACK] Seq=57353 Ack=229 Win=65535 Len=536 [TCP PDU reassembled in 1843]"
"161","6.559405","23.227.142.154","10.200.251.252","TCP","590","80  >  55620 [PSH, ACK] Seq=57889 Ack=229 Win=65535 Len=536 [TCP PDU reassembled in 1843]"
"162","6.559405","23.227.142.154","10.200.251.252","TCP","590","80  >  55620 [ACK] Seq=58425 Ack=229 Win=65535 Len=536 [TCP PDU reassembled in 1843]"
"163","6.559405","23.227.142.154","10.200.251.252","TCP","590","80  >  55620 [PSH, ACK] Seq=58961 Ack=229 Win=65535 Len=536 [TCP PDU reassembled in 1843]"
"164","6.559405","23.227.142.154","10.200.251.252","TCP","590","80  >  55620 [ACK] Seq=59497 Ack=229 Win=65535 Len=536 [TCP PDU reassembled in 1843]"
"165","6.559405","23.227.142.154","10.200.251.252","TCP","590","80  >  55620 [PSH, ACK] Seq=60033 Ack=229 Win=65535 Len=536 [TCP PDU reassembled in 1843]"
"166","6.559405","23.227.142.154","10.200.251.252","TCP","590","80  >  55620 [ACK] Seq=60569 Ack=229 Win=65535 Len=536 [TCP PDU reassembled in 1843]"
"167","6.559405","23.227.142.154","10.200.251.252","TCP","590","80  >  55620 [PSH, ACK] Seq=61105 Ack=229 Win=65535 Len=536 [TCP PDU reassembled in 1843]"
"168","6.559405","23.227.142.154","10.200.251.252","TCP","590","80  >  55620 [ACK] Seq=61641 Ack=229 Win=65535 Len=536 [TCP PDU reassembled in 1843]"
"169","6.559405","23.227.142.154","10.200.251.252","TCP","590","80  >  55620 [PSH, ACK] Seq=62177 Ack=229 Win=65535 Len=536 [TCP PDU reassembled in 1843]"
"170","6.559405","23.227.142.154","10.200.251.252","TCP","590","80  >  55620 [ACK] Seq=62713 Ack=229 Win=65535 Len=536 [TCP PDU reassembled in 1843]"
"171","6.559405","23.227.142.154","10.200.251.252","TCP","590","80  >  55620 [PSH, ACK] Seq=63249 Ack=229 Win=65535 Len=536 [TCP PDU reassembled in 1843]"
"172","6.559405","23.227.142.154","10.200.251.252","TCP","590","80  >  55620 [ACK] Seq=63785 Ack=229 Win=65535 Len=536 [TCP PDU reassembled in 1843]"
"173","6.559405","23.227.142.154","10.200.251.252","TCP","590","80  >  55620 [PSH, ACK] Seq=64321 Ack=229 Win=65535 Len=536 [TCP PDU reassembled in 1843]"
"174","6.559405","23.227.142.154","10.200.251.252","TCP","590","80  >  55620 [ACK] Seq=64857 Ack=229 Win=65535 Len=536 [TCP PDU reassembled in 1843]"
"175","6.559405","23.227.142.154","10.200.251.252","TCP","590","80  >  55620 [PSH, ACK] Seq=65393 Ack=229 Win=65535 Len=536 [TCP PDU reassembled in 1843]"
"176","6.559405","23.227.142.154","10.200.251.252","TCP","590","80  >  55620 [ACK] Seq=65929 Ack=229 Win=65535 Len=536 [TCP PDU reassembled in 1843]"
"177","6.559405","23.227.142.154","10.200.251.252","TCP","590","80  >  55620 [PSH, ACK] Seq=66465 Ack=229 Win=65535 Len=536 [TCP PDU reassembled in 1843]"
"178","6.559405","23.227.142.154","10.200.251.252","TCP","590","80  >  55620 [ACK] Seq=67001 Ack=229 Win=65535 Len=536 [TCP PDU reassembled in 1843]"
"179","6.559405","23.227.142.154","10.200.251.252","TCP","590","80  >  55620 [PSH, ACK] Seq=67537 Ack=229 Win=65535 Len=536 [TCP PDU reassembled in 1843]"
"180","6.559405","23.227.142.154","10.200.251.252","TCP","590","80  >  55620 [ACK] Seq=68073 Ack=229 Win=65535 Len=536 [TCP PDU reassembled in 1843]"
"181","6.559405","23.227.142.154","10.200.251.252","TCP","590","80  >  55620 [PSH, ACK] Seq=68609 Ack=229 Win=65535 Len=536 [TCP PDU reassembled in 1843]"
"182","6.559405","23.227.142.154","10.200.251.252","TCP","590","80  >  55620 [ACK] Seq=69145 Ack=229 Win=65535 Len=536 [TCP PDU reassembled in 1843]"
"183","6.559405","23.227.142.154","10.200.251.252","TCP","590","80  >  55620 [PSH, ACK] Seq=69681 Ack=229 Win=65535 Len=536 [TCP PDU reassembled in 1843]"
"184","6.559405","23.227.142.154","10.200.251.252","TCP","590","80  >  55620 [PSH, ACK] Seq=70217 Ack=229 Win=65535 Len=536 [TCP PDU reassembled in 1843]"
"185","6.559405","23.227.142.154","10.200.251.252","TCP","590","80  >  55620 [ACK] Seq=70753 Ack=229 Win=65535 Len=536 [TCP PDU reassembled in 1843]"
"186","6.559405","23.227.142.154","10.200.251.252","TCP","590","80  >  55620 [PSH, ACK] Seq=71289 Ack=229 Win=65535 Len=536 [TCP PDU reassembled in 1843]"
"187","6.559405","23.227.142.154","10.200.251.252","TCP","590","80  >  55620 [ACK] Seq=71825 Ack=229 Win=65535 Len=536 [TCP PDU reassembled in 1843]"
"188","6.559405","23.227.142.154","10.200.251.252","TCP","590","80  >  55620 [PSH, ACK] Seq=72361 Ack=229 Win=65535 Len=536 [TCP PDU reassembled in 1843]"
"189","6.559405","23.227.142.154","10.200.251.252","TCP","590","80  >  55620 [ACK] Seq=72897 Ack=229 Win=65535 Len=536 [TCP PDU reassembled in 1843]"
"190","6.559405","23.227.142.154","10.200.251.252","TCP","590","80  >  55620 [PSH, ACK] Seq=73433 Ack=229 Win=65535 Len=536 [TCP PDU reassembled in 1843]"
"191","6.559603","10.200.251.252","23.227.142.154","TCP","54","55620  >  80 [ACK] Seq=229 Ack=73969 Win=65535 Len=0"
"192","6.559709","23.227.142.154","10.200.251.252","TCP","590","80  >  55620 [ACK] Seq=73969 Ack=229 Win=65535 Len=536 [TCP PDU reassembled in 1843]"
"193","6.559709","23.227.142.154","10.200.251.252","TCP","590","80  >  55620 [PSH, ACK] Seq=74505 Ack=229 Win=65535 Len=536 [TCP PDU reassembled in 1843]"
"194","6.559709","23.227.142.154","10.200.251.252","TCP","590","80  >  55620 [ACK] Seq=75041 Ack=229 Win=65535 Len=536 [TCP PDU reassembled in 1843]"
"195","6.559709","23.227.142.154","10.200.251.252","TCP","590","80  >  55620 [PSH, ACK] Seq=75577 Ack=229 Win=65535 Len=536 [TCP PDU reassembled in 1843]"
"196","6.559709","23.227.142.154","10.200.251.252","TCP","590","80  >  55620 [ACK] Seq=76113 Ack=229 Win=65535 Len=536 [TCP PDU reassembled in 1843]"
"197","6.559709","23.227.142.154","10.200.251.252","TCP","590","80  >  55620 [PSH, ACK] Seq=76649 Ack=229 Win=65535 Len=536 [TCP PDU reassembled in 1843]"
"198","6.559709","23.227.142.154","10.200.251.252","TCP","590","80  >  55620 [ACK] Seq=77185 Ack=229 Win=65535 Len=536 [TCP PDU reassembled in 1843]"
"199","6.559709","23.227.142.154","10.200.251.252","TCP","590","80  >  55620 [PSH, ACK] Seq=77721 Ack=229 Win=65535 Len=536 [TCP PDU reassembled in 1843]"
"200","6.559709","23.227.142.154","10.200.251.252","TCP","590","80  >  55620 [ACK] Seq=78257 Ack=229 Win=65535 Len=536 [TCP PDU reassembled in 1843]"
"201","6.559709","23.227.142.154","10.200.251.252","TCP","590","80  >  55620 [PSH, ACK] Seq=78793 Ack=229 Win=65535 Len=536 [TCP PDU reassembled in 1843]"
"202","6.559709","23.227.142.154","10.200.251.252","TCP","590","80  >  55620 [ACK] Seq=79329 Ack=229 Win=65535 Len=536 [TCP PDU reassembled in 1843]"
"203","6.559709","23.227.142.154","10.200.251.252","TCP","590","80  >  55620 [PSH, ACK] Seq=79865 Ack=229 Win=65535 Len=536 [TCP PDU reassembled in 1843]"
"204","6.559768","10.200.251.252","23.227.142.154","TCP","54","55620  >  80 [ACK] Seq=229 Ack=80401 Win=65535 Len=0"
"205","6.560318","2401:4900:633f:c147:1c1d:acc7:1e68:b337","2600:140f:5e00:5::17d3:3c71","TCP","74","53172  >  443 [FIN, ACK] Seq=1 Ack=26 Win=1023 Len=0"
"206","6.591412","2600:140f:5e00:5::17d3:3c71","2401:4900:633f:c147:1c1d:acc7:1e68:b337","TCP","74","[TCP Retransmission] 443  >  53172 [FIN, ACK] Seq=25 Ack=1 Win=566 Len=0"
"207","6.591446","2401:4900:633f:c147:1c1d:acc7:1e68:b337","2600:140f:5e00:5::17d3:3c71","TCP","74","[TCP Dup ACK 125#1] 53172  >  443 [ACK] Seq=2 Ack=26 Win=1023 Len=0"
"208","6.763274","10.200.251.252","10.200.251.29","DNS","74","Standard query 0x6e05 A assets.msn.com"
"209","6.763399","10.200.251.252","10.200.251.29","DNS","74","Standard query 0xcd6d AAAA assets.msn.com"
"210","6.786062","2600:140f:5e00:5::17d3:3c71","2401:4900:633f:c147:1c1d:acc7:1e68:b337","TCP","74","443  >  53172 [ACK] Seq=26 Ack=2 Win=566 Len=0"
"211","6.792027","10.200.251.29","10.200.251.252","DNS","246","Standard query response 0x6e05 A assets.msn.com CNAME assets-msn-com-world-atm-default.trafficmanager.net CNAME assets.msn.com-ion.edgesuite.net CNAME a1666.dscr.akamai.net A 23.53.240.248 A 23.53.240.224"
"212","6.841847","23.227.142.154","10.200.251.252","TCP","590","80  >  55620 [ACK] Seq=80401 Ack=229 Win=65535 Len=536 [TCP PDU reassembled in 1843]"
"213","6.841847","23.227.142.154","10.200.251.252","TCP","590","80  >  55620 [PSH, ACK] Seq=80937 Ack=229 Win=65535 Len=536 [TCP PDU reassembled in 1843]"
"214","6.841847","23.227.142.154","10.200.251.252","TCP","590","80  >  55620 [ACK] Seq=81473 Ack=229 Win=65535 Len=536 [TCP PDU reassembled in 1843]"
"215","6.841847","23.227.142.154","10.200.251.252","TCP","590","80  >  55620 [PSH, ACK] Seq=82009 Ack=229 Win=65535 Len=536 [TCP PDU reassembled in 1843]"
"216","6.841847","23.227.142.154","10.200.251.252","TCP","590","80  >  55620 [ACK] Seq=82545 Ack=229 Win=65535 Len=536 [TCP PDU reassembled in 1843]"
"217","6.841847","23.227.142.154","10.200.251.252","TCP","590","80  >  55620 [PSH, ACK] Seq=83081 Ack=229 Win=65535 Len=536 [TCP PDU reassembled in 1843]"
"218","6.841847","23.227.142.154","10.200.251.252","TCP","590","80  >  55620 [ACK] Seq=83617 Ack=229 Win=65535 Len=536 [TCP PDU reassembled in 1843]"
"219","6.841847","23.227.142.154","10.200.251.252","TCP","590","80  >  55620 [PSH, ACK] Seq=84153 Ack=229 Win=65535 Len=536 [TCP PDU reassembled in 1843]"
"220","6.841847","23.227.142.154","10.200.251.252","TCP","590","80  >  55620 [ACK] Seq=84689 Ack=229 Win=65535 Len=536 [TCP PDU reassembled in 1843]"
"221","6.841847","23.227.142.154","10.200.251.252","TCP","590","80  >  55620 [PSH, ACK] Seq=85225 Ack=229 Win=65535 Len=536 [TCP PDU reassembled in 1843]"
"222","6.841847","23.227.142.154","10.200.251.252","TCP","590","80  >  55620 [ACK] Seq=85761 Ack=229 Win=65535 Len=536 [TCP PDU reassembled in 1843]"
"223","6.841847","23.227.142.154","10.200.251.252","TCP","590","80  >  55620 [PSH, ACK] Seq=86297 Ack=229 Win=65535 Len=536 [TCP PDU reassembled in 1843]"
"224","6.841847","23.227.142.154","10.200.251.252","TCP","590","80  >  55620 [ACK] Seq=86833 Ack=229 Win=65535 Len=536 [TCP PDU reassembled in 1843]"
"225","6.841847","23.227.142.154","10.200.251.252","TCP","590","80  >  55620 [PSH, ACK] Seq=87369 Ack=229 Win=65535 Len=536 [TCP PDU reassembled in 1843]"
"226","6.841847","23.227.142.154","10.200.251.252","TCP","590","80  >  55620 [ACK] Seq=87905 Ack=229 Win=65535 Len=536 [TCP PDU reassembled in 1843]"
"227","6.841847","23.227.142.154","10.200.251.252","TCP","590","80  >  55620 [PSH, ACK] Seq=88441 Ack=229 Win=65535 Len=536 [TCP PDU reassembled in 1843]"
"228","6.841847","23.227.142.154","10.200.251.252","TCP","590","80  >  55620 [ACK] Seq=88977 Ack=229 Win=65535 Len=536 [TCP PDU reassembled in 1843]"
"229","6.841847","23.227.142.154","10.200.251.252","TCP","590","80  >  55620 [PSH, ACK] Seq=89513 Ack=229 Win=65535 Len=536 [TCP PDU reassembled in 1843]"
"230","6.841847","23.227.142.154","10.200.251.252","TCP","590","80  >  55620 [ACK] Seq=90049 Ack=229 Win=65535 Len=536 [TCP PDU reassembled in 1843]"
"231","6.841847","23.227.142.154","10.200.251.252","TCP","590","80  >  55620 [PSH, ACK] Seq=90585 Ack=229 Win=65535 Len=536 [TCP PDU reassembled in 1843]"
"232","6.841847","23.227.142.154","10.200.251.252","TCP","590","80  >  55620 [ACK] Seq=91121 Ack=229 Win=65535 Len=536 [TCP PDU reassembled in 1843]"
"233","6.841847","23.227.142.154","10.200.251.252","TCP","590","80  >  55620 [PSH, ACK] Seq=91657 Ack=229 Win=65535 Len=536 [TCP PDU reassembled in 1843]"
"234","6.841847","23.227.142.154","10.200.251.252","TCP","590","80  >  55620 [ACK] Seq=92193 Ack=229 Win=65535 Len=536 [TCP PDU reassembled in 1843]"
"235","6.841847","23.227.142.154","10.200.251.252","TCP","590","80  >  55620 [PSH, ACK] Seq=92729 Ack=229 Win=65535 Len=536 [TCP PDU reassembled in 1843]"
"236","6.841847","23.227.142.154","10.200.251.252","TCP","590","80  >  55620 [ACK] Seq=93265 Ack=229 Win=65535 Len=536 [TCP PDU reassembled in 1843]"
"237","6.841847","23.227.142.154","10.200.251.252","TCP","590","80  >  55620 [PSH, ACK] Seq=93801 Ack=229 Win=65535 Len=536 [TCP PDU reassembled in 1843]"
"238","6.841847","23.227.142.154","10.200.251.252","TCP","590","80  >  55620 [ACK] Seq=94337 Ack=229 Win=65535 Len=536 [TCP PDU reassembled in 1843]"
"239","6.841847","23.227.142.154","10.200.251.252","TCP","590","80  >  55620 [PSH, ACK] Seq=94873 Ack=229 Win=65535 Len=536 [TCP PDU reassembled in 1843]"
"240","6.841847","23.227.142.154","10.200.251.252","TCP","590","80  >  55620 [ACK] Seq=95409 Ack=229 Win=65535 Len=536 [TCP PDU reassembled in 1843]"
"241","6.841847","23.227.142.154","10.200.251.252","TCP","590","80  >  55620 [PSH, ACK] Seq=95945 Ack=229 Win=65535 Len=536 [TCP PDU reassembled in 1843]"
"242","6.841847","23.227.142.154","10.200.251.252","TCP","590","80  >  55620 [ACK] Seq=96481 Ack=229 Win=65535 Len=536 [TCP PDU reassembled in 1843]"
"243","6.841847","23.227.142.154","10.200.251.252","TCP","590","80  >  55620 [PSH, ACK] Seq=97017 Ack=229 Win=65535 Len=536 [TCP PDU reassembled in 1843]"
"244","6.842008","10.200.251.252","23.227.142.154","TCP","54","55620  >  80 [ACK] Seq=229 Ack=97553 Win=65535 Len=0"
"245","6.842132","23.227.142.154","10.200.251.252","TCP","590","80  >  55620 [ACK] Seq=97553 Ack=229 Win=65535 Len=536 [TCP PDU reassembled in 1843]"
"246","6.842132","23.227.142.154","10.200.251.252","TCP","590","80  >  55620 [PSH, ACK] Seq=98089 Ack=229 Win=65535 Len=536 [TCP PDU reassembled in 1843]"
"247","6.842132","23.227.142.154","10.200.251.252","TCP","590","80  >  55620 [ACK] Seq=98625 Ack=229 Win=65535 Len=536 [TCP PDU reassembled in 1843]"
"248","6.842132","23.227.142.154","10.200.251.252","TCP","590","80  >  55620 [PSH, ACK] Seq=99161 Ack=229 Win=65535 Len=536 [TCP PDU reassembled in 1843]"
"249","6.842132","23.227.142.154","10.200.251.252","TCP","590","80  >  55620 [ACK] Seq=99697 Ack=229 Win=65535 Len=536 [TCP PDU reassembled in 1843]"
"250","6.842132","23.227.142.154","10.200.251.252","TCP","590","80  >  55620 [PSH, ACK] Seq=100233 Ack=229 Win=65535 Len=536 [TCP PDU reassembled in 1843]"
"251","6.842132","23.227.142.154","10.200.251.252","TCP","590","80  >  55620 [ACK] Seq=100769 Ack=229 Win=65535 Len=536 [TCP PDU reassembled in 1843]"
"252","6.842132","23.227.142.154","10.200.251.252","TCP","590","80  >  55620 [PSH, ACK] Seq=101305 Ack=229 Win=65535 Len=536 [TCP PDU reassembled in 1843]"
"253","6.842132","23.227.142.154","10.200.251.252","TCP","590","80  >  55620 [ACK] Seq=101841 Ack=229 Win=65535 Len=536 [TCP PDU reassembled in 1843]"
"254","6.842132","23.227.142.154","10.200.251.252","TCP","590","80  >  55620 [PSH, ACK] Seq=102377 Ack=229 Win=65535 Len=536 [TCP PDU reassembled in 1843]"
"255","6.842132","23.227.142.154","10.200.251.252","TCP","590","80  >  55620 [ACK] Seq=102913 Ack=229 Win=65535 Len=536 [TCP PDU reassembled in 1843]"
"256","6.842132","23.227.142.154","10.200.251.252","TCP","590","80  >  55620 [ACK] Seq=103449 Ack=229 Win=65535 Len=536 [TCP PDU reassembled in 1843]"
"257","6.842132","23.227.142.154","10.200.251.252","TCP","590","80  >  55620 [PSH, ACK] Seq=103985 Ack=229 Win=65535 Len=536 [TCP PDU reassembled in 1843]"
"258","6.842132","23.227.142.154","10.200.251.252","TCP","590","80  >  55620 [ACK] Seq=104521 Ack=229 Win=65535 Len=536 [TCP PDU reassembled in 1843]"
"259","6.842132","23.227.142.154","10.200.251.252","TCP","590","80  >  55620 [PSH, ACK] Seq=105057 Ack=229 Win=65535 Len=536 [TCP PDU reassembled in 1843]"
"260","6.842132","23.227.142.154","10.200.251.252","TCP","590","80  >  55620 [ACK] Seq=105593 Ack=229 Win=65535 Len=536 [TCP PDU reassembled in 1843]"
"261","6.842132","23.227.142.154","10.200.251.252","TCP","590","80  >  55620 [PSH, ACK] Seq=106129 Ack=229 Win=65535 Len=536 [TCP PDU reassembled in 1843]"
"262","6.842132","23.227.142.154","10.200.251.252","TCP","590","80  >  55620 [ACK] Seq=106665 Ack=229 Win=65535 Len=536 [TCP PDU reassembled in 1843]"
"263","6.842132","23.227.142.154","10.200.251.252","TCP","590","80  >  55620 [PSH, ACK] Seq=107201 Ack=229 Win=65535 Len=536 [TCP PDU reassembled in 1843]"
"264","6.842132","23.227.142.154","10.200.251.252","TCP","590","80  >  55620 [ACK] Seq=107737 Ack=229 Win=65535 Len=536 [TCP PDU reassembled in 1843]"
"265","6.842132","23.227.142.154","10.200.251.252","TCP","590","80  >  55620 [PSH, ACK] Seq=108273 Ack=229 Win=65535 Len=536 [TCP PDU reassembled in 1843]"
"266","6.842132","23.227.142.154","10.200.251.252","TCP","590","80  >  55620 [ACK] Seq=108809 Ack=229 Win=65535 Len=536 [TCP PDU reassembled in 1843]"
"267","6.842132","23.227.142.154","10.200.251.252","TCP","590","80  >  55620 [PSH, ACK] Seq=109345 Ack=229 Win=65535 Len=536 [TCP PDU reassembled in 1843]"
